<?xml version="1.0" encoding="UTF-8"?>
<!DOCTYPE plugin-config SYSTEM "../../dtd/plugin_config_file.dtd">
<plugin-config name="SOLEIL's Mambo plug-in configuration file">


<!-- ============================================
==  CONFIG 1: detection by file information    ==
============================================= -->
  <dataset-model name="fully_defined_conf">
    <plugin>
      <java>
        <set name="HDB_RAC" value=""/>
        <set name="HDB_DRIVER" value="jdbc:oracle:thin"/>
        <set name="HDB_HOST" value="LUTIN"/>
        <set name="HDB_NAME" value="TEST11"/>
        <set name="HDB_PORT" value="1521"/>
        <set name="HDB_SCHEMA" value=""/>
        <!--
        <set name="HDB_USER" value=""/>
        <set name="HDB_PASSWORD" value=""/>
        -->
        <set name="TDB_RAC" value=""/>
        <set name="TDB_DRIVER" value="jdbc:oracle:thin"/>
        <set name="TDB_HOST" value="LUTIN"/>
        <set name="TDB_NAME" value="TEST11"/>
        <set name="TDB_PORT" value="1521"/>
        <set name="TDB_SCHEMA" value=""/>
        <!--
        <set name="TDB_USER" value=""/>
        <set name="TDB_PASSWORD" value=""/>
        -->
      </java>
    </plugin>
  </dataset-model>
</plugin-config>

